{
  "$schema": "https://json-schema.org/draft/2020-12/schema",
  "$id": "https://leadpoet.ai/schemas/research_evaluation_score_bundle.schema.json",
  "title": "Leadpoet Research Lab Evaluation Score Bundle",
  "type": "object",
  "additionalProperties": false,
  "required": [
    "schema_version",
    "bundle_type",
    "run_id",
    "ticket_id",
    "miner_hotkey",
    "island",
    "evaluation_epoch",
    "parent_artifact_hash",
    "candidate_artifact_hash",
    "private_model_manifest_hash",
    "candidate_patch_hash",
    "icp_set_hash",
    "scoring_version",
    "evaluator_version",
    "benchmark_split_ref",
    "evidence_bundle_refs",
    "execution_trace_ref",
    "cost_ledger_ref",
    "aggregates",
    "improvement_gate",
    "score_bundle_hash",
    "anchored_hash",
    "signature_ref",
    "reward_path"
  ],
  "properties": {
    "schema_version": { "enum": ["1.0", "1.1"] },
    "bundle_type": { "const": "research_lab_evaluation_score_bundle" },
    "run_id": { "type": "string", "format": "uuid" },
    "ticket_id": { "type": "string", "format": "uuid" },
    "miner_hotkey": { "type": "string", "minLength": 16 },
    "island": { "type": "string", "minLength": 1 },
    "evaluation_epoch": { "type": "integer", "minimum": 0 },
    "parent_artifact_hash": { "$ref": "#/$defs/sha256" },
    "candidate_artifact_hash": { "$ref": "#/$defs/sha256" },
    "private_model_manifest_hash": { "$ref": "#/$defs/sha256" },
    "candidate_patch_hash": { "$ref": "#/$defs/sha256" },
    "icp_set_hash": { "$ref": "#/$defs/sha256" },
    "scoring_version": { "type": "string", "minLength": 1 },
    "evaluator_version": { "type": "string", "minLength": 1 },
    "benchmark_split_ref": { "type": "string", "minLength": 1 },
    "evidence_bundle_refs": {
      "type": "array",
      "items": { "type": "string", "minLength": 1 }
    },
    "execution_trace_ref": { "type": "string", "minLength": 1 },
    "cost_ledger_ref": { "type": "string", "minLength": 1 },
    "candidate_model_manifest_hash": { "$ref": "#/$defs/sha256" },
    "candidate_source_diff_hash": { "$ref": "#/$defs/sha256" },
    "candidate_build_ref": { "type": "string" },
    "serving_model_version": { "type": "object" },
    "private_holdout_gate": { "type": "object" },
    "scoring_health": { "type": "object" },
    "provider_excluded_icp_ids": {
      "type": "array",
      "items": { "type": "string" }
    },
    "aggregates": {
      "type": "object",
      "required": [
        "icp_count",
        "successful_icp_count",
        "hard_failure_count",
        "base_score",
        "candidate_score",
        "mean_delta",
        "sd_delta",
        "se_delta",
        "delta_lcb",
        "leads_per_icp_normalizer",
        "lcb_z",
        "per_icp_results"
      ],
      "properties": {
        "icp_count": { "type": "integer", "minimum": 1 },
        "successful_icp_count": { "type": "integer", "minimum": 0 },
        "hard_failure_count": { "type": "integer", "minimum": 0 },
        "base_score": { "type": "number", "minimum": -100 },
        "candidate_score": { "type": "number", "minimum": -100 },
        "mean_delta": { "type": "number" },
        "sd_delta": { "type": "number", "minimum": 0 },
        "se_delta": { "type": "number", "minimum": 0 },
        "delta_lcb": { "type": "number" },
        "total_cost_usd": { "type": "number", "minimum": 0 },
        "leads_per_icp_normalizer": { "type": "integer", "minimum": 1 },
        "fp_penalty_points": { "type": "number", "minimum": 0 },
        "fp_unverified_primary_penalty_points": { "type": "number", "minimum": 0 },
        "fp_penalty_icp_floor": { "const": 0 },
        "lcb_z": { "type": "number", "minimum": 0 },
        "per_icp_results": {
          "type": "array",
          "minItems": 1,
          "items": { "$ref": "#/$defs/per_icp_result" }
        }
      },
      "additionalProperties": false
    },
    "improvement_gate": {
      "type": "object",
      "required": [
        "decision",
        "eligible_for_probation",
        "blockers",
        "policy"
      ],
      "properties": {
        "decision": { "enum": ["eligible_for_probation", "not_eligible"] },
        "eligible_for_probation": { "type": "boolean" },
        "blockers": {
          "type": "array",
          "items": { "type": "string" }
        },
        "policy": { "type": "object" }
      },
      "additionalProperties": false
    },
    "score_bundle_hash": { "$ref": "#/$defs/sha256" },
    "anchored_hash": { "$ref": "#/$defs/sha256" },
    "signature_ref": { "type": "string", "minLength": 1 },
    "reward_path": {
      "type": "object",
      "required": [
        "eligible_for_probation",
        "eligible_for_crown",
        "eligible_for_improvement_grant",
        "reason"
      ],
      "properties": {
        "eligible_for_probation": { "type": "boolean" },
        "eligible_for_crown": { "type": "boolean" },
        "eligible_for_improvement_grant": { "type": "boolean" },
        "reason": { "type": "string" }
      },
      "additionalProperties": false
    }
  },
  "$defs": {
    "sha256": {
      "type": "string",
      "pattern": "^sha256:[0-9a-f]{64}$"
    },
    "per_icp_result": {
      "type": "object",
      "additionalProperties": false,
      "required": [
        "icp_ref",
        "icp_hash",
        "status",
        "hard_failure",
        "base_company_scores",
        "candidate_company_scores",
        "base_per_icp_score",
        "candidate_per_icp_score",
        "delta_vs_base",
        "failure_reason"
      ],
      "properties": {
        "icp_ref": { "type": "string" },
        "icp_hash": { "$ref": "#/$defs/sha256" },
        "icp_company_goal": {
          "type": "integer",
          "minimum": 1,
          "maximum": 50,
          "description": "Requested company count for this ICP (max_companies); per-ICP scores normalize against it. Absent on bundles built before dynamic goals."
        },
        "status": { "type": "string" },
        "hard_failure": { "type": "boolean" },
        "base_company_scores": {
          "type": "array",
          "items": { "type": "number", "minimum": 0, "maximum": 100 }
        },
        "candidate_company_scores": {
          "type": "array",
          "items": { "type": "number", "minimum": 0, "maximum": 100 }
        },
        "base_per_icp_score": { "type": "number", "minimum": -100 },
        "candidate_per_icp_score": { "type": "number", "minimum": -100 },
        "delta_vs_base": { "type": "number" },
        "base_fp_gate_count": { "type": "integer", "minimum": 0 },
        "base_fp_unverified_primary_count": { "type": "integer", "minimum": 0 },
        "candidate_fp_gate_count": { "type": "integer", "minimum": 0 },
        "candidate_fp_unverified_primary_count": { "type": "integer", "minimum": 0 },
        "failure_reason": { "type": "string" },
        "provider_excluded": { "type": "boolean" },
        "sourced_zero_no_error": { "type": "boolean" },
        "reference_sourced_zero_no_error": { "type": "boolean" },
        "incontainer_trace_ref": { "type": "string" },
        "incontainer_trace_sha256": { "type": "string" },
        "incontainer_trace_call_count": { "type": "integer", "minimum": 0 },
        "incontainer_trace_truncated_count": { "type": "integer", "minimum": 0 },
        "incontainer_trace_dropped": { "type": "boolean" },
        "incontainer_trace_dropped_call_count": { "type": "integer", "minimum": 0 },
        "scorer_trace_ref": { "type": "string" },
        "scorer_trace_sha256": { "type": "string" },
        "l0_findings": {
          "type": "array",
          "items": { "$ref": "#/$defs/l0_per_claim_finding" }
        }
      }
    },
    "l0_per_claim_finding": {
      "type": "object",
      "additionalProperties": false,
      "required": ["company_index", "claim_index", "snapshot_available", "checks"],
      "properties": {
        "company_index": { "type": "integer", "minimum": 0 },
        "claim_index": { "type": "integer", "minimum": 0 },
        "snapshot_available": { "type": "boolean" },
        "failed_check_count": { "type": "integer", "minimum": 0 },
        "checks": {
          "type": "array",
          "items": {
            "type": "object",
            "additionalProperties": false,
            "required": ["check_id", "status"],
            "properties": {
              "check_id": { "type": "string", "maxLength": 80 },
              "status": { "enum": ["pass", "fail", "warn"] }
            }
          }
        }
      }
    }
  }
}
